{
  "$schema": "https://json-schema.org/draft/2020-12/schema",
  "title": "gap",
  "type": "object",
  "required": ["id", "source", "title", "status", "created"],
  "properties": {
    "id":       {"type": "string"},
    "source":   {"type": "string"},
    "title":    {"type": "string"},
    "context":  {"type": "string"},
    "status":   {"type": "string", "enum": ["open", "acknowledged", "resolved"]},
    "created":  {"type": "string"},
    "resolution": {"type": ["string", "null"]}
  }
}
