{
  "id": "G2",
  "source": "lume",
  "title": "lume review ingest writes repo files (findings.md, result.json) outside any workstream, so review artifacts are orphaned until some workstream commits them",
  "context": "Operator note after review-2026-06-11-01: the repo rule is every change lands through a workstream, but the review verb creates landable state with no workstream linkage - nothing carries the commit. Proposed: define how review output enters history, e.g. ingest is run inside (or proposes) a review-adoption workstream, or the queue plan includes the workstream that commits the artifacts.",
  "status": "open",
  "created": "2026-06-11",
  "resolution": null
}
